id,product,category,signature,video_id,payload_json,created_at,state,reserved_at,reserved_by,ingest_key
444,green,ug,c5af74ea858431f1:M/W,3825,"{""ad"": {""name"": ""3825_2_Grüne Helfer (1)"", ""status"": ""PAUSED""}, ""adset"": {""name"": ""(auto)"", ""status"": ""PAUSED"", ""end_time"": null, ""dsa_payor"": ""Naturesupps LLC"", ""objective"": ""OUTCOME_TRAFFIC"", ""targeting"": {""age_max"": 65, ""age_min"": 18, ""geo_locations"": {""countries"": [""AT"", ""DE""]}}, ""bid_amount"": null, ""start_time"": null, ""bid_strategy"": ""LOWEST_COST_WITHOUT_CAP"", ""daily_budget"": 10000, ""billing_event"": ""IMPRESSIONS"", ""dsa_beneficiary"": ""Naturesupps LLC"", ""lifetime_budget"": null, ""promoted_object"": null, ""optimization_goal"": ""LINK_CLICKS"", ""is_adset_budget_sharing_enabled"": false}, ""assets"": {""video_id"": null, ""image_url"": ""https://drive.google.com/file/d/1QIwRscaxUJYRTVYNJoOxXhWIF6Qk6TB9/view?usp=sharing"", ""media_url"": ""https://drive.google.com/file/d/1QIwRscaxUJYRTVYNJoOxXhWIF6Qk6TB9/view?usp=sharing"", ""video_url"": null, ""image_hash"": null, ""image_path"": null, ""media_type"": null, ""video_path"": null}, ""product"": ""green"", ""audience"": ""M/W"", ""batching"": true, ""campaign"": {""name"": ""(auto)"", ""status"": ""PAUSED"", ""objective"": ""OUTCOME_TRAFFIC"", ""buying_type"": null, ""daily_budget"": null, ""lifetime_budget"": null, ""special_ad_categories"": [], ""is_adset_budget_sharing_enabled"": false}, ""category"": ""ug"", ""creative"": {""name"": ""3825_2_Grüne Helfer (1)"", ""url_tags"": ""trc_mcmp_id={{campaign.id}}&trc_mag_id={{adset.id}}&trc_mad_id={{ad.id}}"", ""text_options"": {""headlines"": [""Mehr gutes Gefühl im Alltag 🌿"", ""So wurde Routine leicht für mich 🙂"", ""Tägliches Ritual, grüner Helfer ✨""], ""descriptions"": [""Meine Erfahrung: einfach & wohltuend 🙂"", ""Weniger Grübeln, mehr Routine 💡"", ""Ehrlicher Bericht – jetzt reinlesen 👉""], ""primary_texts"": [""Grünen Helfer Ritual – ich hab das fest in meinen Tag geholt und bin sooo froh darüber. Am Anfang war ich skeptisch, doch jetzt freue ich mich jeden Tag auf mein kleines Ritual. Es erdet mich, fühlt sich gut an und macht den Kopf frei. Ich mixe mir den Drink ganz entspannt und nehme mir diese Minute nur für mich. 👉 Klick jetzt direkt unter dem Beitrag und lies, was mir wirklich geholfen hat."", ""Anfangs skeptisch, heute Routine: Das Grünen Helfer Ritual ist schnell gemixt, alltagstauglich und wirklich wohltuend. Eine Minute täglich, die mir Ruhe schenkt und weniger Grübeln bringt. Kein Zauber, nur eine einfache Routine, die wirkt. ✨🌿"", ""Mein tägliches Ritual mit dem grünen Drink hat meinen Alltag verändert – mehr Klarheit, weniger Stress. Es ist simpel, erdet mich und lässt sich leicht einbauen. Ich freue mich, dass ihr es genauso liebt wie ich. Lies meinen ehrlichen Bericht unter dem Beitrag. 🙌""]}, ""asset_feed_spec"": null, ""object_story_spec"": {""page_id"": ""985534861302115"", ""link_data"": {""link"": ""https://naturgesundcheck.com/landing/gh-2026-259/"", ""name"": ""Mehr gutes Gefühl im Alltag 🌿"", ""message"": ""Grünen Helfer Ritual – ich hab das fest in meinen Tag geholt und bin sooo froh darüber. Am Anfang war ich skeptisch, doch jetzt freue ich mich jeden Tag auf mein kleines Ritual. Es erdet mich, fühlt sich gut an und macht den Kopf frei. Ich mixe mir den Drink ganz entspannt und nehme mir diese Minute nur für mich. 👉 Klick jetzt direkt unter dem Beitrag und lies, was mir wirklich geholfen hat."", ""description"": ""Meine Erfahrung: einfach & wohltuend 🙂"", ""call_to_action"": {""type"": ""LEARN_MORE"", ""value"": {""link"": ""https://naturgesundcheck.com/landing/gh-2026-259/""}}}}, ""degrees_of_freedom_spec"": null}, ""countries"": [""AT"", ""DE""], ""offer_page"": ""LP"", ""product_code"": ""GH"", ""product_label"": ""Grüne Helfer"", ""schema_version"": 2}",2026-02-24 09:39:21.109624+00,queued,,,12a69bebcc24cd84c9c639086e59c6c9b0af24ac195d265970451eb43e8a7e7e
445,green,ug,c5af74ea858431f1:M/W,3851,"{""ad"": {""name"": ""3851_0_Grüne Helfer (1)"", ""status"": ""PAUSED""}, ""adset"": {""name"": ""(auto)"", ""status"": ""PAUSED"", ""end_time"": null, ""dsa_payor"": ""Naturesupps LLC"", ""objective"": ""OUTCOME_TRAFFIC"", ""targeting"": {""age_max"": 65, ""age_min"": 18, ""geo_locations"": {""countries"": [""AT"", ""DE""]}}, ""bid_amount"": null, ""start_time"": null, ""bid_strategy"": ""LOWEST_COST_WITHOUT_CAP"", ""daily_budget"": 10000, ""billing_event"": ""IMPRESSIONS"", ""dsa_beneficiary"": ""Naturesupps LLC"", ""lifetime_budget"": null, ""promoted_object"": null, ""optimization_goal"": ""LINK_CLICKS"", ""is_adset_budget_sharing_enabled"": false}, ""assets"": {""video_id"": null, ""image_url"": ""https://drive.google.com/file/d/1tIJn01wNQdd0q-UyNE9URm7BBBBLp1Ib/view?usp=sharing"", ""media_url"": ""https://drive.google.com/file/d/1tIJn01wNQdd0q-UyNE9URm7BBBBLp1Ib/view?usp=sharing"", ""video_url"": null, ""image_hash"": null, ""image_path"": null, ""media_type"": null, ""video_path"": null}, ""product"": ""green"", ""audience"": ""M/W"", ""batching"": true, ""campaign"": {""name"": ""(auto)"", ""status"": ""PAUSED"", ""objective"": ""OUTCOME_TRAFFIC"", ""buying_type"": null, ""daily_budget"": null, ""lifetime_budget"": null, ""special_ad_categories"": [], ""is_adset_budget_sharing_enabled"": false}, ""category"": ""ug"", ""creative"": {""name"": ""3851_0_Grüne Helfer (1)"", ""url_tags"": ""trc_mcmp_id={{campaign.id}}&trc_mag_id={{adset.id}}&trc_mad_id={{ad.id}}"", ""text_options"": {""headlines"": [""Mehr Schwung trotz Hänger ⚡"", ""Hänger? So helfe ich mir 🙂"", ""Meine grünen Helfer 🌿""], ""descriptions"": [""Meine Erfahrung: wacher & klarer 🙂"", ""Weniger Durchhänger, mehr Fokus ⚡"", ""Ehrlicher Bericht – jetzt reinlesen 👉""], ""primary_texts"": [""Hänger heute? Ich kenn’s. Ich saß da und kam nicht in Gang 😓 Statt noch ’nen Kaffee hab ich mir mein grünes Glas angerührt – simple Lösung, kein Hexenwerk. Die Kombi aus Matcha, Gerstengras und Spirulina gibt mir einen sanften Kick ohne Zittern; nach ein paar Minuten fühl ich mich klarer im Kopf und weniger schlapp ⚡. Schmeckt leicht nach Apfel/Heidelbeere, löst sich schnell in Wasser. Meine kleinen „grünen Helfer“ für zwischendurch, wenn der Tag länger wird 🌿 ▪️ So nutze ich’s: morgens oder beim „Durchhänger“. ▪️ Was ich merke: wacher, fokussierter, ruhiger im Gefühl 💡 ▪️ Drin laut Packung: Matcha, Gerstengras, Spirulina, Ceylon-Zimt ✨ 👉 Klick jetzt unter dem Beitrag und lies dich rein, warum das so ist – was mir wirklich geholfen hat."", ""Kein Bock auf Kaffee? Ich rühre mir stattdessen ein grünes Glas mit Matcha, Gerstengras und Spirulina an — schnell in Wasser, leichter Apfel/Heidelbeer-Geschmack. Gibt mir einen klaren, ruhigen Fokus ohne Zittern, ideal morgens oder beim Durchhänger. Laut Packung: Matcha, Gerstengras, Spirulina, Ceylon-Zimt. Klick unten für mehr Infos."", ""Wenn der Nachmittag einbricht, greife ich zu meinem grünen Mix: Matcha + Gerstengras + Spirulina mit etwas Ceylon-Zimt. Schon nach wenigen Minuten bin ich wacher und konzentrierter, aber entspannt — kein Koffein-Ruckeln. Schmeckt fruchtig, lässt sich schnell anrühren. Meine Empfehlung: morgens oder bei Leistungstiefs. Mehr dazu unter dem Beitrag.""]}, ""asset_feed_spec"": null, ""object_story_spec"": {""page_id"": ""985534861302115"", ""link_data"": {""link"": ""https://naturgesundcheck.com/landing/gh-2026-259/"", ""name"": ""Mehr Schwung trotz Hänger ⚡"", ""message"": ""Hänger heute? Ich kenn’s. Ich saß da und kam nicht in Gang 😓 Statt noch ’nen Kaffee hab ich mir mein grünes Glas angerührt – simple Lösung, kein Hexenwerk. Die Kombi aus Matcha, Gerstengras und Spirulina gibt mir einen sanften Kick ohne Zittern; nach ein paar Minuten fühl ich mich klarer im Kopf und weniger schlapp ⚡. Schmeckt leicht nach Apfel/Heidelbeere, löst sich schnell in Wasser. Meine kleinen „grünen Helfer“ für zwischendurch, wenn der Tag länger wird 🌿 ▪️ So nutze ich’s: morgens oder beim „Durchhänger“. ▪️ Was ich merke: wacher, fokussierter, ruhiger im Gefühl 💡 ▪️ Drin laut Packung: Matcha, Gerstengras, Spirulina, Ceylon-Zimt ✨ 👉 Klick jetzt unter dem Beitrag und lies dich rein, warum das so ist – was mir wirklich geholfen hat."", ""description"": ""Meine Erfahrung: wacher & klarer 🙂"", ""call_to_action"": {""type"": ""LEARN_MORE"", ""value"": {""link"": ""https://naturgesundcheck.com/landing/gh-2026-259/""}}}}, ""degrees_of_freedom_spec"": null}, ""countries"": [""AT"", ""DE""], ""offer_page"": ""LP"", ""product_code"": ""GH"", ""product_label"": ""Grüne Helfer"", ""schema_version"": 2}",2026-02-24 09:39:29.38476+00,queued,,,17e459a8cfee13727ffef9f8acbf542f539e8a4ac804454ab30c5bf4a1d56fb3
446,green,ug,c5af74ea858431f1:M/W,3843,"{""ad"": {""name"": ""3843_0_Grüne Helfer (1)"", ""status"": ""PAUSED""}, ""adset"": {""name"": ""(auto)"", ""status"": ""PAUSED"", ""end_time"": null, ""dsa_payor"": ""Naturesupps LLC"", ""objective"": ""OUTCOME_TRAFFIC"", ""targeting"": {""age_max"": 65, ""age_min"": 18, ""geo_locations"": {""countries"": [""AT"", ""DE""]}}, ""bid_amount"": null, ""start_time"": null, ""bid_strategy"": ""LOWEST_COST_WITHOUT_CAP"", ""daily_budget"": 10000, ""billing_event"": ""IMPRESSIONS"", ""dsa_beneficiary"": ""Naturesupps LLC"", ""lifetime_budget"": null, ""promoted_object"": null, ""optimization_goal"": ""LINK_CLICKS"", ""is_adset_budget_sharing_enabled"": false}, ""assets"": {""video_id"": null, ""image_url"": ""https://drive.google.com/file/d/1dyTQSGPsutjk4rZzLPj8wijCIjiuU3JH/view?usp=sharing"", ""media_url"": ""https://drive.google.com/file/d/1dyTQSGPsutjk4rZzLPj8wijCIjiuU3JH/view?usp=sharing"", ""video_url"": null, ""image_hash"": null, ""image_path"": null, ""media_type"": null, ""video_path"": null}, ""product"": ""green"", ""audience"": ""M/W"", ""batching"": true, ""campaign"": {""name"": ""(auto)"", ""status"": ""PAUSED"", ""objective"": ""OUTCOME_TRAFFIC"", ""buying_type"": null, ""daily_budget"": null, ""lifetime_budget"": null, ""special_ad_categories"": [], ""is_adset_budget_sharing_enabled"": false}, ""category"": ""ug"", ""creative"": {""name"": ""3843_0_Grüne Helfer (1)"", ""url_tags"": ""trc_mcmp_id={{campaign.id}}&trc_mag_id={{adset.id}}&trc_mad_id={{ad.id}}"", ""text_options"": {""headlines"": [""Einfaches Morgenritual: grüner Drink 🌿"", ""Eine Packung reicht: ca. 1 Monat ⏳"", ""Täglich dranbleiben statt 'Alles oder Nichts'""], ""descriptions"": [""Morgens grünes Pulver anrühren, trinken, dranbleiben. Simpel und wirkungsvoll."", ""Eine Packung reicht mindestens einen Monat – praktisch für den Alltag."", ""Kleine tägliche Gewohnheit statt großer Umstellungen: rühren, trinken, abhaken.""], ""primary_texts"": [""Regelmäßig dranbleiben – das war bei mir der Knackpunkt. 🙌 Ich habe mir lange zu viel auf einmal vorgenommen und dann wieder aufgegeben. 😓 Heute mache ich es simpel: morgens meinen grünen Drink (GRÜNE HELFER) ins Wasser rühren und fertig. 🌿 Keine Dramen, nur Routine. Eine Packung reicht bei mir mindestens einen Monat, so muss ich nicht ständig nachbestellen. ⏳ Mein Tipp: täglich dranbleiben statt 'alles oder nichts' – anrühren, trinken, abhaken. 👉 Klick unter dem Beitrag und lies, was mir wirklich geholfen hat."", ""Für mich zählt die Routine: einmal täglich mein grünes Pulver ins Wasser rühren und gut ist. 💡✨ Kein großes Drumherum, keine Ausreden – kleine Schritte, konstant bleiben. 🙂 Eine Packung hält bei mir circa einen Monat – perfekt, um dran zu bleiben. 🙌 Wenn du wissen willst, warum das bei mir funktioniert, schau unter den Beitrag."", ""Ich habe gelernt, dass weniger mehr ist: statt alles auf einmal zu ändern nehme ich täglich meinen grünen Drink. 🌿 Simpel, schnell und alltagstauglich. Bei mir reicht eine Packung mindestens einen Monat, deshalb bleibe ich eher dabei. ✅ Mein Tipp: einmal täglich anrühren, trinken, abhaken. 👇 Lies jetzt unter dem Beitrag, was mir geholfen hat.""]}, ""asset_feed_spec"": null, ""object_story_spec"": {""page_id"": ""985534861302115"", ""link_data"": {""link"": ""https://naturgesundcheck.com/landing/gh-2026-259/"", ""name"": ""Einfaches Morgenritual: grüner Drink 🌿"", ""message"": ""Regelmäßig dranbleiben – das war bei mir der Knackpunkt. 🙌 Ich habe mir lange zu viel auf einmal vorgenommen und dann wieder aufgegeben. 😓 Heute mache ich es simpel: morgens meinen grünen Drink (GRÜNE HELFER) ins Wasser rühren und fertig. 🌿 Keine Dramen, nur Routine. Eine Packung reicht bei mir mindestens einen Monat, so muss ich nicht ständig nachbestellen. ⏳ Mein Tipp: täglich dranbleiben statt 'alles oder nichts' – anrühren, trinken, abhaken. 👉 Klick unter dem Beitrag und lies, was mir wirklich geholfen hat."", ""description"": ""Morgens grünes Pulver anrühren, trinken, dranbleiben. Simpel und wirkungsvoll."", ""call_to_action"": {""type"": ""LEARN_MORE"", ""value"": {""link"": ""https://naturgesundcheck.com/landing/gh-2026-259/""}}}}, ""degrees_of_freedom_spec"": null}, ""countries"": [""AT"", ""DE""], ""offer_page"": ""LP"", ""product_code"": ""GH"", ""product_label"": ""Grüne Helfer"", ""schema_version"": 2}",2026-02-24 09:39:51.932758+00,queued,,,4fa078286da327f1c0277c3f291fb036abcb0d05c57157b39ec552fccb3a1015
447,green,ug,c5af74ea858431f1:M/W,3852,"{""ad"": {""name"": ""3852_0_Grüne Helfer (1)"", ""status"": ""PAUSED""}, ""adset"": {""name"": ""(auto)"", ""status"": ""PAUSED"", ""end_time"": null, ""dsa_payor"": ""Naturesupps LLC"", ""objective"": ""OUTCOME_TRAFFIC"", ""targeting"": {""age_max"": 65, ""age_min"": 18, ""geo_locations"": {""countries"": [""AT"", ""DE""]}}, ""bid_amount"": null, ""start_time"": null, ""bid_strategy"": ""LOWEST_COST_WITHOUT_CAP"", ""daily_budget"": 10000, ""billing_event"": ""IMPRESSIONS"", ""dsa_beneficiary"": ""Naturesupps LLC"", ""lifetime_budget"": null, ""promoted_object"": null, ""optimization_goal"": ""LINK_CLICKS"", ""is_adset_budget_sharing_enabled"": false}, ""assets"": {""video_id"": null, ""image_url"": ""https://drive.google.com/file/d/17nUrYTCx7Nlkw2i7-m174Fo6c9nsBhEI/view?usp=sharing"", ""media_url"": ""https://drive.google.com/file/d/17nUrYTCx7Nlkw2i7-m174Fo6c9nsBhEI/view?usp=sharing"", ""video_url"": null, ""image_hash"": null, ""image_path"": null, ""media_type"": null, ""video_path"": null}, ""product"": ""green"", ""audience"": ""M/W"", ""batching"": true, ""campaign"": {""name"": ""(auto)"", ""status"": ""PAUSED"", ""objective"": ""OUTCOME_TRAFFIC"", ""buying_type"": null, ""daily_budget"": null, ""lifetime_budget"": null, ""special_ad_categories"": [], ""is_adset_budget_sharing_enabled"": false}, ""category"": ""ug"", ""creative"": {""name"": ""3852_0_Grüne Helfer (1)"", ""url_tags"": ""trc_mcmp_id={{campaign.id}}&trc_mag_id={{adset.id}}&trc_mad_id={{ad.id}}"", ""text_options"": {""headlines"": [""Apfelsaft + Grüner Helfer 🍎🌿"", ""Meine Morgen-Routine, auch im Urlaub ✨"", ""Einfach mischen, besser fühlen 🙂""], ""descriptions"": [""Meine Erfahrung: täglich und easy 🙂"", ""Weniger Grübeln, mehr Routine 💡"", ""Ehrlicher Bericht – jetzt reinlesen 👉""], ""primary_texts"": [""Apfelsaft am Morgen: Ohne ihn starte ich nicht. 🍎 Für meinen Grünen Helfer ist das einfach wichtig – so bleibt’s leicht und routiniert. 🙂 Ich rühre meinen Drink mit Apfelsaft an; mild im Geschmack und easy für den Start in den Tag. 🌿 Auch im Urlaub trinke ich ihn täglich, weil mir die kleine Routine gut tut und ich mich ausgeglichener fühle. ✨ ▪️ Jeden Morgen fix gemixt – null Aufwand ⚡ ▪️ Mit Apfelsaft schmeckt’s mir einfach besser 🍎 ▪️ Auch unterwegs bleibt die Routine drin ✈️ 👉 Klick jetzt unter dem Beitrag und lies, warum das so ist – was mir wirklich geholfen hat."", ""Ich mixe meinen Grünen Helfer mit Apfelsaft – schnell, mild und lecker. 🍎🌿 Kein Aufwand, nur ein kleiner Ritual-Moment, der mir hilft, ruhiger zu bleiben. Auch im Urlaub funktioniert das super und gibt mir Ausgeglichenheit. ✨ Lies weiter unter dem Beitrag, wenn du meine Erfahrungen wissen willst."", ""Einfach mischen, besser fühlen: Apfelsaft plus Grüner Helfer sind mein täglicher Start. 🍎🌿 Ob zu Hause oder unterwegs – das ist meine unkomplizierte Routine gegen Grübeln und Stress. 💡👉 Schau dir meinen ehrlichen Bericht an und erfahre, warum es mir so geholfen hat.""]}, ""asset_feed_spec"": null, ""object_story_spec"": {""page_id"": ""985534861302115"", ""link_data"": {""link"": ""https://naturgesundcheck.com/landing/gh-2026-259/"", ""name"": ""Apfelsaft + Grüner Helfer 🍎🌿"", ""message"": ""Apfelsaft am Morgen: Ohne ihn starte ich nicht. 🍎 Für meinen Grünen Helfer ist das einfach wichtig – so bleibt’s leicht und routiniert. 🙂 Ich rühre meinen Drink mit Apfelsaft an; mild im Geschmack und easy für den Start in den Tag. 🌿 Auch im Urlaub trinke ich ihn täglich, weil mir die kleine Routine gut tut und ich mich ausgeglichener fühle. ✨ ▪️ Jeden Morgen fix gemixt – null Aufwand ⚡ ▪️ Mit Apfelsaft schmeckt’s mir einfach besser 🍎 ▪️ Auch unterwegs bleibt die Routine drin ✈️ 👉 Klick jetzt unter dem Beitrag und lies, warum das so ist – was mir wirklich geholfen hat."", ""description"": ""Meine Erfahrung: täglich und easy 🙂"", ""call_to_action"": {""type"": ""LEARN_MORE"", ""value"": {""link"": ""https://naturgesundcheck.com/landing/gh-2026-259/""}}}}, ""degrees_of_freedom_spec"": null}, ""countries"": [""AT"", ""DE""], ""offer_page"": ""LP"", ""product_code"": ""GH"", ""product_label"": ""Grüne Helfer"", ""schema_version"": 2}",2026-02-24 09:39:56.890027+00,queued,,,6edbb74cc4133c35343fc3da1ec93bcc5514bd308fd96189a1b95202ef76ff1a
448,rosa,ug,c5af74ea858431f1:M/W,3830,"{""ad"": {""name"": ""3830_0_Rosa Glanz (1)"", ""status"": ""PAUSED""}, ""adset"": {""name"": ""(auto)"", ""status"": ""PAUSED"", ""end_time"": null, ""dsa_payor"": ""Naturesupps LLC"", ""objective"": ""OUTCOME_TRAFFIC"", ""targeting"": {""age_max"": 65, ""age_min"": 18, ""geo_locations"": {""countries"": [""AT"", ""DE""]}}, ""bid_amount"": null, ""start_time"": null, ""bid_strategy"": ""LOWEST_COST_WITHOUT_CAP"", ""daily_budget"": 10000, ""billing_event"": ""IMPRESSIONS"", ""dsa_beneficiary"": ""Naturesupps LLC"", ""lifetime_budget"": null, ""promoted_object"": null, ""optimization_goal"": ""LINK_CLICKS"", ""is_adset_budget_sharing_enabled"": false}, ""assets"": {""video_id"": null, ""image_url"": ""https://drive.google.com/file/d/1hO8z3POqEwvzqYdRlQtLTgNRxSPBLTrO/view?usp=sharing"", ""media_url"": ""https://drive.google.com/file/d/1hO8z3POqEwvzqYdRlQtLTgNRxSPBLTrO/view?usp=sharing"", ""video_url"": null, ""image_hash"": null, ""image_path"": null, ""media_type"": null, ""video_path"": null}, ""product"": ""rosa"", ""audience"": ""M/W"", ""batching"": true, ""campaign"": {""name"": ""(auto)"", ""status"": ""PAUSED"", ""objective"": ""OUTCOME_TRAFFIC"", ""buying_type"": null, ""daily_budget"": null, ""lifetime_budget"": null, ""special_ad_categories"": [], ""is_adset_budget_sharing_enabled"": false}, ""category"": ""ug"", ""creative"": {""name"": ""3830_0_Rosa Glanz (1)"", ""url_tags"": ""trc_mcmp_id={{campaign.id}}&trc_mag_id={{adset.id}}&trc_mad_id={{ad.id}}"", ""text_options"": {""headlines"": [""Mehr Glanz & Glow ✨"", ""Fahler Teint? So war’s bei mir 💆‍♀️"", ""Täglich Kollagen – meine Routine 🌿""], ""descriptions"": [""Meine Erfahrung: Haare stärker & Haut frischer 🙂"", ""Weniger brüchig, mehr Glow 💡"", ""Ehrlicher Bericht – jetzt reinlesen 👉""], ""primary_texts"": [""Kollagen täglich? Ich war anfangs skeptisch: „Kollagen funktioniert doch gar nicht.“ 🤷‍♀️🥺 Vorher hatte ich brüchige Spitzen, Haare im Kamm und einen fahlen Teint mit Unreinheiten – das hat mich genervt. 😓 Ich habe trotzdem jeden Tag meinen Drink genommen. Nach und nach wurden meine Haare spürbar stärker und glänzender, der Ausfall ging zurück. Meine Haut wirkt straffer, frischer und hat mehr Glow. Für mich war das eine echte Erleichterung. ✨🙌 ▪️ weniger brüchiges Haar, fühlbar stärker 💪 ▪️ kaum noch Haare in Bürste & Dusche 💇‍♀️ ▪️ straffere, frischere Haut mit mehr Glow 💆‍♀️ 👉 Klick jetzt unter dem Beitrag und lies, warum das so ist – was mir wirklich geholfen hat. 🔥"", ""Kurz und ehrlich: Ich dachte, Kollagen bringt nichts. Nach Wochen mit meinem täglichen Drink sah ich echte Veränderungen – weniger Haarbruch, deutlich weniger Haare in Bürste & Dusche und eine frischere, straffere Haut mit Glow. Kein großes Tamtam, einfach Alltag und sichtbare Ergebnisse. ✨"", ""Ehrlicher Erfahrungsbericht: Meine Haare waren brüchig und mein Teint fahl. Mit meiner täglichen Kollagen-Routine wurden die Haare kräftiger und fielen weniger aus, die Haut wirkte glatter und strahlender. Kein Wundermittel, aber für mich ein echter Unterschied – lies gern meinen Beitrag dazu. 🙌""]}, ""asset_feed_spec"": null, ""object_story_spec"": {""page_id"": ""985534861302115"", ""link_data"": {""link"": ""https://naturgesundcheck.com/landing/rg-2026-260/"", ""name"": ""Mehr Glanz & Glow ✨"", ""message"": ""Kollagen täglich? Ich war anfangs skeptisch: „Kollagen funktioniert doch gar nicht.“ 🤷‍♀️🥺 Vorher hatte ich brüchige Spitzen, Haare im Kamm und einen fahlen Teint mit Unreinheiten – das hat mich genervt. 😓 Ich habe trotzdem jeden Tag meinen Drink genommen. Nach und nach wurden meine Haare spürbar stärker und glänzender, der Ausfall ging zurück. Meine Haut wirkt straffer, frischer und hat mehr Glow. Für mich war das eine echte Erleichterung. ✨🙌 ▪️ weniger brüchiges Haar, fühlbar stärker 💪 ▪️ kaum noch Haare in Bürste & Dusche 💇‍♀️ ▪️ straffere, frischere Haut mit mehr Glow 💆‍♀️ 👉 Klick jetzt unter dem Beitrag und lies, warum das so ist – was mir wirklich geholfen hat. 🔥"", ""description"": ""Meine Erfahrung: Haare stärker & Haut frischer 🙂"", ""call_to_action"": {""type"": ""LEARN_MORE"", ""value"": {""link"": ""https://naturgesundcheck.com/landing/rg-2026-260/""}}}}, ""degrees_of_freedom_spec"": null}, ""countries"": [""AT"", ""DE""], ""offer_page"": ""LP"", ""product_code"": ""RG"", ""product_label"": ""Rosa Glanz"", ""schema_version"": 2}",2026-02-24 10:33:21.208215+00,queued,,,7cd22f1c66a5b2d9e2fe6641851a9e36253b2ddcf3f3728e5c7053291b0e2efe
